pub_date	title	authors	venue	excerpt	citation	url_slug	paper_url	abstract	bibtex	bibtype	bibid	year	pages	doi	volume	number
2023-07-01	A Natural Bias for Language Generation Models	Clara Meister, Wojciech Stokowiec, Tiago Pimentel, Lei Yu, Laura Rimell, Adhiguna Kuncoro	Proceedings of the 61st Annual Meeting of the Association for Computational Linguistics (Volume 2: Short Papers)		Clara Meister, Wojciech Stokowiec, Tiago Pimentel, Lei Yu, Laura Rimell, and Adhiguna Kuncoro. 2023. A Natural Bias for Language Generation Models. In Proceedings of the 61st Annual Meeting of the Association for Computational Linguistics (Volume 2: Short Papers), pages 243–255, Toronto, Canada. Association for Computational Linguistics.	meister-etal-2023-natural	https://aclanthology.org/2023.acl-short.22/	After just a few hundred training updates, a standard probabilistic model for language generation has likely not yet learnt many semantic or syntactic rules of natural language, making it difficult to estimate the probability distribution over next tokens. Yet around this point, these models have identified a simple, loss-minimising behaviour: to output the unigram distribution of the target training corpus. The use of such a heuristic raises the question: Can we initialise our models with this behaviour and save precious compute resources and model capacity? Here we show that we can effectively endow standard neural language generation models with a separate module that reflects unigram frequency statistics as prior knowledge, simply by initialising the bias term in a model’s final linear layer with the log-unigram distribution. We use neural machine translation as a test bed for this simple technique and observe that it: (i) improves learning efficiency; (ii) achieves better overall performance; and perhaps most importantly (iii) appears to disentangle strong frequency effects by encouraging the model to specialise in non-frequency-related aspects of language.	@inproceedings{meister-etal-2023-natural,     title = "A Natural Bias for Language Generation Models",     author = "Meister, Clara  and       Stokowiec, Wojciech  and       Pimentel, Tiago  and       Yu, Lei  and       Rimell, Laura  and       Kuncoro, Adhiguna",     booktitle = "Proceedings of the 61st Annual Meeting of the Association for Computational Linguistics (Volume 2: Short Papers)",     month = jul,     year = "2023",     address = "Toronto, Canada",     publisher = "Association for Computational Linguistics",     url = "https://aclanthology.org/2023.acl-short.22",     pages = "243--255",     abstract = "After just a few hundred training updates, a standard probabilistic model for language generation has likely not yet learnt many semantic or syntactic rules of natural language, making it difficult to estimate the probability distribution over next tokens. Yet around this point, these models have identified a simple, loss-minimising behaviour: to output the unigram distribution of the target training corpus. The use of such a heuristic raises the question: Can we initialise our models with this behaviour and save precious compute resources and model capacity? Here we show that we can effectively endow standard neural language generation models with a separate module that reflects unigram frequency statistics as prior knowledge, simply by initialising the bias term in a model{'}s final linear layer with the log-unigram distribution. We use neural machine translation as a test bed for this simple technique and observe that it: (i) improves learning efficiency; (ii) achieves better overall performance; and perhaps most importantly (iii) appears to disentangle strong frequency effects by encouraging the model to specialise in non-frequency-related aspects of language.", }	inproceedings	meister-etal-2023-natural	2023	243--255			
2023-07-02	A Measure-Theoretic Characterization of Tight Language Models	Li Du, Lucas Torroba Hennigen, Tiago Pimentel, Clara Meister, Jason Eisner, Ryan Cotterell	Proceedings of the 61st Annual Meeting of the Association for Computational Linguistics (Volume 1: Long Papers)		Li Du, Lucas Torroba Hennigen, Tiago Pimentel, Clara Meister, Jason Eisner, and Ryan Cotterell. 2023. A Measure-Theoretic Characterization of Tight Language Models. In Proceedings of the 61st Annual Meeting of the Association for Computational Linguistics (Volume 1: Long Papers), pages 9744–9770, Toronto, Canada. Association for Computational Linguistics.	du-etal-2023-measure	https://aclanthology.org/2023.acl-long.543/	Language modeling, a central task in natural language processing, involves estimating a probability distribution over strings. In most cases, the estimated distribution sums to 1 over all finite strings. However, in some pathological cases, probability mass can “leak” onto the set of infinite sequences. In order to characterize the notion of leakage more precisely, this paper offers a measure-theoretic treatment of language modeling. We prove that many popular language model families are in fact tight, meaning that they will not leak in this sense. We also generalize characterizations of tightness proposed in previous works.	@inproceedings{du-etal-2023-measure,     title = "A Measure-Theoretic Characterization of Tight Language Models",     author = "Du, Li  and       Torroba Hennigen, Lucas  and       Pimentel, Tiago  and       Meister, Clara  and       Eisner, Jason  and       Cotterell, Ryan",     booktitle = "Proceedings of the 61st Annual Meeting of the Association for Computational Linguistics (Volume 1: Long Papers)",     month = jul,     year = "2023",     address = "Toronto, Canada",     publisher = "Association for Computational Linguistics",     url = "https://aclanthology.org/2023.acl-long.543",     pages = "9744--9770",     abstract = "Language modeling, a central task in natural language processing, involves estimating a probability distribution over strings. In most cases, the estimated distribution sums to 1 over all finite strings. However, in some pathological cases, probability mass can {``}leak{''} onto the set of infinite sequences. In order to characterize the notion of leakage more precisely, this paper offers a measure-theoretic treatment of language modeling. We prove that many popular language model families are in fact tight, meaning that they will not leak in this sense. We also generalize characterizations of tightness proposed in previous works.", }	inproceedings	du-etal-2023-measure	2023	9744--9770			
2023-07-03	Few-shot Fine-tuning vs. In-context Learning: A Fair Comparison and Evaluation	Marius Mosbach, Tiago Pimentel, Shauli Ravfogel, Dietrich Klakow, Yanai Elazar	Findings of the Association for Computational Linguistics: ACL 2023		Marius Mosbach, Tiago Pimentel, Shauli Ravfogel, Dietrich Klakow, and Yanai Elazar. 2023. Few-shot Fine-tuning vs. In-context Learning: A Fair Comparison and Evaluation. In Findings of the Association for Computational Linguistics: ACL 2023, pages 12284–12314, Toronto, Canada. Association for Computational Linguistics.	mosbach-etal-2023-shot	https://aclanthology.org/2023.findings-acl.779/	Few-shot fine-tuning and in-context learning are two alternative strategies for task adaptation of pre-trained language models. Recently, in-context learning has gained popularity over fine-tuning due to its simplicity and improved out-of-domain generalization, and because extensive evidence shows that fine-tuned models pick up on spurious correlations.Unfortunately, previous comparisons of the two approaches were done using models of different sizes. This raises the question of whether the observed weaker out-of-domain generalization of fine-tuned models is an inherent property of fine-tuning or a limitation of the experimental setup. In this paper, we compare the generalization of few-shot fine-tuning and in-context learning to challenge datasets, while controlling for the models used, the number of examples, and the number of parameters, ranging from 125M to 30B. Our results show that fine-tuned language models can in fact generalize well out-of-domain. We find that both approaches generalize similarly; they exhibit large variation and depend on properties such as model size and the number of examples, highlighting that robust task adaptation remains a challenge.	@inproceedings{mosbach-etal-2023-shot,     title = "Few-shot Fine-tuning vs. In-context Learning: A Fair Comparison and Evaluation",     author = "Mosbach, Marius  and       Pimentel, Tiago  and       Ravfogel, Shauli  and       Klakow, Dietrich  and       Elazar, Yanai",     booktitle = "Findings of the Association for Computational Linguistics: ACL 2023",     month = jul,     year = "2023",     address = "Toronto, Canada",     publisher = "Association for Computational Linguistics",     url = "https://aclanthology.org/2023.findings-acl.779",     pages = "12284--12314",     abstract = "Few-shot fine-tuning and in-context learning are two alternative strategies for task adaptation of pre-trained language models. Recently, in-context learning has gained popularity over fine-tuning due to its simplicity and improved out-of-domain generalization, and because extensive evidence shows that fine-tuned models pick up on spurious correlations.Unfortunately, previous comparisons of the two approaches were done using models of different sizes. This raises the question of whether the observed weaker out-of-domain generalization of fine-tuned models is an inherent property of fine-tuning or a limitation of the experimental setup. In this paper, we compare the generalization of few-shot fine-tuning and in-context learning to challenge datasets, while controlling for the models used, the number of examples, and the number of parameters, ranging from 125M to 30B. Our results show that fine-tuned language models can in fact generalize well out-of-domain. We find that both approaches generalize similarly; they exhibit large variation and depend on properties such as model size and the number of examples, highlighting that robust task adaptation remains a challenge.", }	inproceedings	mosbach-etal-2023-shot	2023	12284--12314			
2023-07-04	On the Efficacy of Sampling Adapters	Clara Meister, Tiago Pimentel, Luca Malagutti, Ethan Wilcox, Ryan Cotterell	Proceedings of the 61st Annual Meeting of the Association for Computational Linguistics (Volume 1: Long Papers)		Clara Meister, Tiago Pimentel, Luca Malagutti, Ethan Wilcox, and Ryan Cotterell. 2023. On the Efficacy of Sampling Adapters. In Proceedings of the 61st Annual Meeting of the Association for Computational Linguistics (Volume 1: Long Papers), pages 1437–1455, Toronto, Canada. Association for Computational Linguistics.	meister-etal-2023-efficacy	https://aclanthology.org/2023.acl-long.80/	Sampling-based decoding strategies are widely employed for generating text from probabilistic models, yet standard ancestral sampling often results in text that is degenerate or incoherent. To alleviate this issue, various modifications to a model’s sampling distribution, such as top-p or top-k sampling, have been introduced and are now ubiquitously used in language generation systems. We propose a unified framework for understanding these techniques, which we term sampling adapters. Sampling adapters often lead to qualitatively better text, which raises the question: From a formal perspective, how are they changing the token-level distributions of language generation models? And why do these local changes lead to higher-quality text? We argue that the shift they enforce can be viewed as a trade-off between precision and recall: while the model loses its ability to produce certain strings, its precision rate on desirable text increases. While this trade-off is not reflected in standard metrics of distribution quality (such as perplexity), we find that several precision-emphasizing measures indeed indicate that sampling adapters can lead to probability distributions more aligned with the true distribution. Further, these measures correlate with higher sequence-level quality scores, specifically, Mauve.	@inproceedings{meister-etal-2023-efficacy,     title = "On the Efficacy of Sampling Adapters",     author = "Meister, Clara  and       Pimentel, Tiago  and       Malagutti, Luca  and       Wilcox, Ethan  and       Cotterell, Ryan",     booktitle = "Proceedings of the 61st Annual Meeting of the Association for Computational Linguistics (Volume 1: Long Papers)",     month = jul,     year = "2023",     address = "Toronto, Canada",     publisher = "Association for Computational Linguistics",     url = "https://aclanthology.org/2023.acl-long.80",     pages = "1437--1455",     abstract = "Sampling-based decoding strategies are widely employed for generating text from probabilistic models, yet standard ancestral sampling often results in text that is degenerate or incoherent. To alleviate this issue, various modifications to a model{'}s sampling distribution, such as top-p or top-k sampling, have been introduced and are now ubiquitously used in language generation systems. We propose a unified framework for understanding these techniques, which we term sampling adapters. Sampling adapters often lead to qualitatively better text, which raises the question: From a formal perspective, how are they changing the token-level distributions of language generation models? And why do these local changes lead to higher-quality text? We argue that the shift they enforce can be viewed as a trade-off between precision and recall: while the model loses its ability to produce certain strings, its precision rate on desirable text increases. While this trade-off is not reflected in standard metrics of distribution quality (such as perplexity), we find that several precision-emphasizing measures indeed indicate that sampling adapters can lead to probability distributions more aligned with the true distribution. Further, these measures correlate with higher sequence-level quality scores, specifically, Mauve.", }	inproceedings	meister-etal-2023-efficacy	2023	1437--1455			
2023-02-01	Locally Typical Sampling	Clara Meister, Tiago Pimentel, Gian Wiher, Ryan Cotterell	Transactions of the Association for Computational Linguistics, Volume 11		Clara Meister, Tiago Pimentel, Gian Wiher, and Ryan Cotterell. 2023. Locally Typical Sampling. Transactions of the Association for Computational Linguistics, 11:102–121.	meister-etal-2023-locally	https://aclanthology.org/2023.tacl-1.7/	Today’s probabilistic language generators fall short when it comes to producing coherent and fluent text despite the fact that the underlying models perform well under standard metrics (e.g., perplexity). This discrepancy has puzzled the language generation community for the last few years. In this work, we posit that the abstraction of natural language generation as a discrete stochastic process—which allows for an information-theoretic analysis—can provide new insights into the behavior of probabilistic language generators, for example, why high-probability texts can be dull or repetitive. Humans use language as a means of communicating information, aiming to do so in a simultaneously efficient and error-minimizing manner; in fact, psycholinguistics research suggests humans choose each word in a string with this subconscious goal in mind. We formally define the set of strings that meet this criterion: Those for which each word has an information content close to the expected information content, namely, the conditional entropy of our model. We then propose a simple and efficient procedure for enforcing this criterion when generating from probabilistic models, which we call locally typical sampling. Automatic and human evaluations show that, in comparison to nucleus and top-k sampling, locally typical sampling offers competitive performance (in both abstractive summarization and story generation) in terms of quality while consistently reducing degenerate repetitions.	@article{meister-etal-2023-locally,     title = "Locally Typical Sampling",     author = "Meister, Clara  and       Pimentel, Tiago  and       Wiher, Gian  and       Cotterell, Ryan",     journal = "Transactions of the Association for Computational Linguistics",     volume = "11",     year = "2023",     address = "Cambridge, MA",     publisher = "MIT Press",     url = "https://aclanthology.org/2023.tacl-1.7",     doi = "10.1162/tacl_a_00536",     pages = "102--121",     abstract = "Today{'}s probabilistic language generators fall short when it comes to producing coherent and fluent text despite the fact that the underlying models perform well under standard metrics (e.g., perplexity). This discrepancy has puzzled the language generation community for the last few years. In this work, we posit that the abstraction of natural language generation as a discrete stochastic process{---}which allows for an information-theoretic analysis{---}can provide new insights into the behavior of probabilistic language generators, for example, why high-probability texts can be dull or repetitive. Humans use language as a means of communicating information, aiming to do so in a simultaneously efficient and error-minimizing manner; in fact, psycholinguistics research suggests humans choose each word in a string with this subconscious goal in mind. We formally define the set of strings that meet this criterion: Those for which each word has an information content close to the expected information content, namely, the conditional entropy of our model. We then propose a simple and efficient procedure for enforcing this criterion when generating from probabilistic models, which we call locally typical sampling. Automatic and human evaluations show that, in comparison to nucleus and top-k sampling, locally typical sampling offers competitive performance (in both abstractive summarization and story generation) in terms of quality while consistently reducing degenerate repetitions.", }	article	meister-etal-2023-locally	2023	102--121	10.1162/tacl_a_00536	11	
2023-02-02	Naturalistic Causal Probing for Morpho-Syntax	Afra Amini, Tiago Pimentel, Clara Meister, Ryan Cotterell	Transactions of the Association for Computational Linguistics, Volume 11		Afra Amini, Tiago Pimentel, Clara Meister, and Ryan Cotterell. 2023. Naturalistic Causal Probing for Morpho-Syntax. Transactions of the Association for Computational Linguistics, 11:384–403.	amini-etal-2023-naturalistic	https://aclanthology.org/2023.tacl-1.23/	Probing has become a go-to methodology for interpreting and analyzing deep neural models in natural language processing. However, there is still a lack of understanding of the limitations and weaknesses of various types of probes. In this work, we suggest a strategy for input-level intervention on naturalistic sentences. Using our approach, we intervene on the morpho-syntactic features of a sentence, while keeping the rest of the sentence unchanged. Such an intervention allows us to causally probe pre-trained models. We apply our naturalistic causal probing framework to analyze the effects of grammatical gender and number on contextualized representations extracted from three pre-trained models in Spanish, the multilingual versions of BERT, RoBERTa, and GPT-2. Our experiments suggest that naturalistic interventions lead to stable estimates of the causal effects of various linguistic properties. Moreover, our experiments demonstrate the importance of naturalistic causal probing when analyzing pre-trained models. https://github.com/rycolab/naturalistic-causal-probing	@article{amini-etal-2023-naturalistic,     title = "Naturalistic Causal Probing for Morpho-Syntax",     author = "Amini, Afra  and       Pimentel, Tiago  and       Meister, Clara  and       Cotterell, Ryan",     journal = "Transactions of the Association for Computational Linguistics",     volume = "11",     year = "2023",     address = "Cambridge, MA",     publisher = "MIT Press",     url = "https://aclanthology.org/2023.tacl-1.23",     doi = "10.1162/tacl_a_00554",     pages = "384--403",     abstract = "Probing has become a go-to methodology for interpreting and analyzing deep neural models in natural language processing. However, there is still a lack of understanding of the limitations and weaknesses of various types of probes. In this work, we suggest a strategy for input-level intervention on naturalistic sentences. Using our approach, we intervene on the morpho-syntactic features of a sentence, while keeping the rest of the sentence unchanged. Such an intervention allows us to causally probe pre-trained models. We apply our naturalistic causal probing framework to analyze the effects of grammatical gender and number on contextualized representations extracted from three pre-trained models in Spanish, the multilingual versions of BERT, RoBERTa, and GPT-2. Our experiments suggest that naturalistic interventions lead to stable estimates of the causal effects of various linguistic properties. Moreover, our experiments demonstrate the importance of naturalistic causal probing when analyzing pre-trained models. https://github.com/rycolab/naturalistic-causal-probing", }	article	amini-etal-2023-naturalistic	2023	384--403	10.1162/tacl_a_00554	11	
2023-08-01	A Cross-Linguistic Pressure for Uniform Information Density in Word Order	Thomas Hikaru Clark, Clara Meister, Tiago Pimentel, Michael Hahn, Ryan Cotterell, Richard Futrell, Roger Levy	Transactions of the Association for Computational Linguistics			clark-etal-2023-crosslinguistic	https://arxiv.org/abs/2306.03734	While natural languages differ widely in both canonical word order and word order flexibility, their word orders still follow shared cross-linguistic statistical patterns, often attributed to functional pressures. In the effort to identify these pressures, prior work has compared real and counterfactual word orders. Yet one functional pressure has been overlooked in such investigations: the uniform information density (UID) hypothesis, which holds that information should be spread evenly throughout an utterance. Here, we ask whether a pressure for UID may have influenced word order patterns cross-linguistically. To this end, we use computational models to test whether real orders lead to greater information uniformity than counterfactual orders. In our empirical study of 10 typologically diverse languages, we find that: (i) among SVO languages, real word orders consistently have greater uniformity than reverse word orders, and (ii) only linguistically implausible counterfactual orders consistently exceed the uniformity of real orders. These findings are compatible with a pressure for information uniformity in the development and usage of natural languages. 		article	clark-etal-2023-crosslinguistic	2023				
2023-08-02	The Effect of Surprisal on Reading Times in 11 Languages	Ethan Gotlieb Wilcox, Tiago Pimentel, Clara Meister, Ryan Cotterell, Roger P. Levy	Transactions of the Association for Computational Linguistics			wilcox-etal-2023-effect	https://arxiv.org/abs/2307.03667	A fundamental result in psycholinguistics is that less predictable words take a longer time to process. One theoretical explanation for this finding is Surprisal Theory (Hale, 2001; Levy, 2008), which quantifies a word's predictability as its surprisal, i.e. its negative log-probability given a context. While evidence supporting the predictions of Surprisal Theory have been replicated widely, most have focused on a very narrow slice of data: native English speakers reading English texts. Indeed, no comprehensive multilingual analysis exists. We address this gap in the current literature by investigating the relationship between surprisal and reading times in eleven different languages, distributed across five language families. Deriving estimates from language models trained on monolingual and multilingual corpora, we test three predictions associated with surprisal theory: (i) whether surprisal is predictive of reading times; (ii) whether expected surprisal, i.e. contextual entropy, is predictive of reading times; (iii) and whether the linking function between surprisal and reading times is linear. We find that all three predictions are borne out crosslinguistically. By focusing on a more diverse set of languages, we argue that these results offer the most robust link to-date between information theory and incremental language processing across languages. 		article	wilcox-etal-2023-effect	2023				
