pub_date	title	authors	venue	excerpt	citation	url_slug	paper_url	abstract	bibtex	bibtype	bibid	year	pages	doi	volume	number
2013-03-02	Mapping planetary caves with an autonomous, heterogeneous robot team	Ammar Husain, Heather Jones, Balajee Kannan, Uland Wong, Tiago Pimentel, Sarah Tang, Shreyansh Daftry, Steven Huber, William L. Whittaker	IEEE Aerospace Conference	This paper is about multi-robot exploration. It presents a framework for coordinating and allocating tasks to an heterogeneous group of robots.	Husain A, Jones H, Kannan B, Wong U, Pimentel T, Tang S, Daftry S, Huber S, Whittaker WL. Mapping planetary caves with an autonomous, heterogeneous robot team. In: IEEE Aerospace Conference, 2013 Mar 2 (pp. 1-13). IEEE.	mapping-planetary-caves	https://ieeexplore.ieee.org/document/6497363	Caves on other planetary bodies offer sheltered habitat for future human explorers and numerous clues to a planet's past for scientists. While recent orbital imagery provides exciting new details about cave entrances on the Moon and Mars, the interiors of these caves are still unknown and not observable from orbit. Multi-robot teams offer unique solutions for exploration and modeling subsurface voids during precursor missions. Robot teams that are diverse in terms of size, mobility, sensing, and capability can provide great advantages, but this diversity, coupled with inherently distinct low-level behavior architectures, makes coordination a challenge. This paper presents a framework that consists of an autonomous frontier and capability-based task generator, a distributed market-based strategy for coordinating and allocating tasks to the different team members, and a communication paradigm for seamless interaction between the different robots in the system. Robots have different sensors, (in the representative robot team used for testing: 2D mapping sensors, 3D modeling sensors, or no exteroceptive sensors), and varying levels of mobility. Tasks are generated to explore, model, and take science samples. Based on an individual robot's capability and associated cost for executing a generated task, a robot is autonomously selected for task execution. The robots create coarse online maps and store collected data for high resolution offline modeling. The coordination approach has been field tested at a mock cave site with highly-unstructured natural terrain, as well as an outdoor patio area. Initial results are promising for applicability of the proposed multi-robot framework to exploration and modeling of planetary caves.	@INPROCEEDINGS{husain2013mapping,   author={     Ammar Husain and     Heather Jones and     Balajee Kannan and     Uland Wong and     Tiago Pimentel and     Sarah Tang and     Shreyansh Daftry and     Steven Huber and     William L. Whittaker   },   booktitle={2013 IEEE Aerospace Conference},   title={Mapping planetary caves with an autonomous, heterogeneous robot team},   year={2013},   volume={},   number={},   pages={1-13}, }	inproceedings	husain2013mapping	2013	1-13			
2018-01-01	Detection of bimanual gestures everywhere: Why it matters, what we need and what is missing	Divya Shah, Ernesto Denicia, Tiago Pimentel, Barbara Bruno, Fulvio Mastrogiovanni	Robotics and Autonomous Systems		Shah D, Denicia E, Pimentel T, Bruno B, Mastrogiovanni F. Detection of bimanual gestures everywhere: Why it matters, what we need and what is missing. In: Robotics and Autonomous Systems. 2018 99:30-49.	detection-of-bimanual-gestures	http://www.sciencedirect.com/science/article/pii/S0921889016303773	Bimanual gestures are of the utmost importance for the study of motor coordination in humans and in everyday activities. A reliable detection of bimanual gestures in unconstrained environments is fundamental for their clinical study and to assess common activities of daily living. This paper investigates techniques for a reliable, unconstrained detection and classification of bimanual gestures. The work assumes the availability of inertial data originating from the two hands/arms, builds upon a previously developed technique for gesture modeling based on Gaussian Mixture Modeling (GMM) and Gaussian Mixture Regression (GMR), and compares different modeling and classification techniques, which are based on a number of assumptions inspired by literature about how bimanual gestures are represented and modeled in the brain. Experiments show results related to 5 everyday bimanual activities, which have been selected on the basis of three main parameters: (not) constraining the two hands by a physical tool, (not) requiring a specific sequence of single-hand gestures, being recursive (or not). In the best performing combination of modeling approach and classification technique, we achieve overall accuracy, precision, recall and F1-score above 80%.	@article{shah2018detection, title = "Detection of bimanual gestures everywhere: {W}hy it matters, what we need and what is missing", journal = "Robotics and Autonomous Systems", volume = "99", pages = "30 - 49", year = "2018", issn = "0921-8890", doi = "https://doi.org/10.1016/j.robot.2017.09.016", url = "http://www.sciencedirect.com/science/article/pii/S0921889016303773", author = "Divya Shah and Ernesto Denicia and Tiago Pimentel and Barbara Bruno and Fulvio Mastrogiovanni", }	article	shah2018detection	2018	30 - 49	https://doi.org/10.1016/j.robot.2017.09.016	99	
2022-05-01	On the probability–quality paradox in language generation	Clara Meister, Gian Wiher, Tiago Pimentel, Ryan Cotterell	Proceedings of the 60th Annual Meeting of the Association for Computational Linguistics (Volume 2: Short Papers)		Clara Meister, Gian Wiher, Tiago Pimentel, and Ryan Cotterell. 2022. On the probability–quality paradox in language generation. In Proceedings of the 60th Annual Meeting of the Association for Computational Linguistics (Volume 2: Short Papers), pages 36–45, Dublin, Ireland. Association for Computational Linguistics.	meister-et-al-2022a	https://aclanthology.org/2022.acl-short.5/	When generating natural language from neural probabilistic models, high probability does not always coincide with high quality: It has often been observed that mode-seeking decoding methods, i.e., those that produce high-probability text under the model, lead to unnatural language. On the other hand, the lower-probability text generated by stochastic methods is perceived as more human-like. In this note, we offer an explanation for this phenomenon by analyzing language generation through an information-theoretic lens. Specifically, we posit that human-like language should contain an amount of information (quantified as negative log-probability) that is close to the entropy of the distribution over natural strings. Further, we posit that language with substantially more (or less) information is undesirable. We provide preliminary empirical evidence in favor of this hypothesis; quality ratings of both human and machine-generated text—covering multiple tasks and common decoding strategies—suggest high-quality text has an information content significantly closer to the entropy than we would expect by chance.	@inproceedings{meister-etal-2022-high,     title = "On the probability{--}quality paradox in language generation",     author = "Meister, Clara  and       Wiher, Gian  and       Pimentel, Tiago  and       Cotterell, Ryan",     booktitle = "Proceedings of the 60th Annual Meeting of the Association for Computational Linguistics (Volume 2: Short Papers)",     month = may,     year = "2022",     address = "Dublin, Ireland",     publisher = "Association for Computational Linguistics",     url = "https://aclanthology.org/2022.acl-short.5",     doi = "10.18653/v1/2022.acl-short.5",     pages = "36--45",     abstract = "When generating natural language from neural probabilistic models, high probability does not always coincide with high quality: It has often been observed that mode-seeking decoding methods, i.e., those that produce high-probability text under the model, lead to unnatural language. On the other hand, the lower-probability text generated by stochastic methods is perceived as more human-like. In this note, we offer an explanation for this phenomenon by analyzing language generation through an information-theoretic lens. Specifically, we posit that human-like language should contain an amount of information (quantified as negative log-probability) that is close to the entropy of the distribution over natural strings. Further, we posit that language with substantially more (or less) information is undesirable. We provide preliminary empirical evidence in favor of this hypothesis; quality ratings of both human and machine-generated text{---}covering multiple tasks and common decoding strategies{---}suggest high-quality text has an information content significantly closer to the entropy than we would expect by chance.", }	inproceedings	meister-et-al-2022-high	2022	36--45	10.18653/v1/2022.acl-short.5		
2022-05-02	Analyzing Wrap-Up Effects through an Information-Theoretic Lens	Clara Meister, Tiago Pimentel, Thomas Clark, Ryan Cotterell, Roger Levy	Proceedings of the 60th Annual Meeting of the Association for Computational Linguistics (Volume 2: Short Papers)		Clara Meister, Tiago Pimentel, Thomas Clark, Ryan Cotterell, and Roger Levy. 2022. Analyzing Wrap-Up Effects through an Information-Theoretic Lens. In Proceedings of the 60th Annual Meeting of the Association for Computational Linguistics (Volume 2: Short Papers), pages 20–28, Dublin, Ireland. Association for Computational Linguistics.	meister-et-al-2022b	https://aclanthology.org/2022.acl-short.3/	Numerous analyses of reading time (RT) data have been undertaken in the effort to learn more about the internal processes that occur during reading comprehension. However, data measured on words at the end of a sentence–or even clause–is often omitted due to the confounding factors introduced by so-called “wrap-up effects,” which manifests as a skewed distribution of RTs for these words. Consequently, the understanding of the cognitive processes that might be involved in these effects is limited. In this work, we attempt to learn more about these processes by looking for the existence–or absence–of a link between wrap-up effects and information theoretic quantities, such as word and context information content. We find that the information distribution of prior context is often predictive of sentence- and clause-final RTs (while not of sentence-medial RTs), which lends support to several prior hypotheses about the processes involved in wrap-up effects.	@inproceedings{meister-etal-2022-analyzing,     title = "Analyzing Wrap-Up Effects through an Information-Theoretic Lens",     author = "Meister, Clara  and       Pimentel, Tiago  and       Clark, Thomas  and       Cotterell, Ryan  and       Levy, Roger",     booktitle = "Proceedings of the 60th Annual Meeting of the Association for Computational Linguistics (Volume 2: Short Papers)",     month = may,     year = "2022",     address = "Dublin, Ireland",     publisher = "Association for Computational Linguistics",     url = "https://aclanthology.org/2022.acl-short.3",     doi = "10.18653/v1/2022.acl-short.3",     pages = "20--28",     abstract = "Numerous analyses of reading time (RT) data have been undertaken in the effort to learn more about the internal processes that occur during reading comprehension. However, data measured on words at the end of a sentence{--}or even clause{--}is often omitted due to the confounding factors introduced by so-called {``}wrap-up effects,{''} which manifests as a skewed distribution of RTs for these words. Consequently, the understanding of the cognitive processes that might be involved in these effects is limited. In this work, we attempt to learn more about these processes by looking for the existence{--}or absence{--}of a link between wrap-up effects and information theoretic quantities, such as word and context information content. We find that the information distribution of prior context is often predictive of sentence- and clause-final RTs (while not of sentence-medial RTs), which lends support to several prior hypotheses about the processes involved in wrap-up effects.", }	inproceedings	meister-et-al-2022-analyzing	2022	20--28	10.18653/v1/2022.acl-short.3		
2022-05-03	Probing for the Usage of Grammatical Number	Karim Lasri, Tiago Pimentel, Alessandro Lenci, Thierry Poibeau, Ryan Cotterell	Proceedings of the 60th Annual Meeting of the Association for Computational Linguistics (Volume 2: Short Papers)		Karim Lasri, Tiago Pimentel, Alessandro Lenci, Thierry Poibeau, and Ryan Cotterell. 2022. Probing for the Usage of Grammatical Number. In Proceedings of the 60th Annual Meeting of the Association for Computational Linguistics (Volume 1: Long Papers), pages 8818–8831, Dublin, Ireland. Association for Computational Linguistics.	lasri-et-al-2022	https://aclanthology.org/2022.acl-long.603/	A central quest of probing is to uncover how pre-trained models encode a linguistic property within their representations. An encoding, however, might be spurious—i.e., the model might not rely on it when making predictions. In this paper, we try to find an encoding that the model actually uses, introducing a usage-based probing setup. We first choose a behavioral task which cannot be solved without using the linguistic property. Then, we attempt to remove the property by intervening on the model’s representations. We contend that, if an encoding is used by the model, its removal should harm the performance on the chosen behavioral task. As a case study, we focus on how BERT encodes grammatical number, and on how it uses this encoding to solve the number agreement task. Experimentally, we find that BERT relies on a linear encoding of grammatical number to produce the correct behavioral output. We also find that BERT uses a separate encoding of grammatical number for nouns and verbs. Finally, we identify in which layers information about grammatical number is transferred from a noun to its head verb.	@inproceedings{lasri-etal-2022-probing,     title = "Probing for the Usage of Grammatical Number",     author = "Lasri, Karim  and       Pimentel, Tiago  and       Lenci, Alessandro  and       Poibeau, Thierry  and       Cotterell, Ryan",     booktitle = "Proceedings of the 60th Annual Meeting of the Association for Computational Linguistics (Volume 1: Long Papers)",     month = may,     year = "2022",     address = "Dublin, Ireland",     publisher = "Association for Computational Linguistics",     url = "https://aclanthology.org/2022.acl-long.603",     doi = "10.18653/v1/2022.acl-long.603",     pages = "8818--8831",     abstract = "A central quest of probing is to uncover how pre-trained models encode a linguistic property within their representations. An encoding, however, might be spurious{---}i.e., the model might not rely on it when making predictions. In this paper, we try to find an encoding that the model actually uses, introducing a usage-based probing setup. We first choose a behavioral task which cannot be solved without using the linguistic property. Then, we attempt to remove the property by intervening on the model{'}s representations. We contend that, if an encoding is used by the model, its removal should harm the performance on the chosen behavioral task. As a case study, we focus on how BERT encodes grammatical number, and on how it uses this encoding to solve the number agreement task. Experimentally, we find that BERT relies on a linear encoding of grammatical number to produce the correct behavioral output. We also find that BERT uses a separate encoding of grammatical number for nouns and verbs. Finally, we identify in which layers information about grammatical number is transferred from a noun to its head verb.", }	inproceedings	lasri-et-al-2022-probing	2022	8818--8831	10.18653/v1/2022.acl-long.603		
2022-12-01	The Architectural Bottleneck Principle	Tiago Pimentel, Josef Valvoda, Niklas Stoehr, Ryan Cotterell	Proceedings of the 2022 Conference on Empirical Methods in Natural Language Processing		Tiago Pimentel, Josef Valvoda, Niklas Stoehr, and Ryan Cotterell. 2022. The Architectural Bottleneck Principle. In Proceedings of the 2022 Conference on Empirical Methods in Natural Language Processing, pages 11459–11472, Abu Dhabi, United Arab Emirates. Association for Computational Linguistics.	pimentel-etal-2022	https://aclanthology.org/2022.emnlp-main.788/	In this paper, we seek to measure how much information a component in a neural network could extract from the representations fed into it. Our work stands in contrast to prior probing work, most of which investigates how much information a model's representations contain. This shift in perspective leads us to propose a new principle for probing, the architectural bottleneck principle: In order to estimate how much information a given component could extract, a probe should look exactly like the component. Relying on this principle, we estimate how much syntactic information is available to transformers through our attentional probe, a probe that exactly resembles a transformer's self-attention head. Experimentally, we find that, in three models (BERT, ALBERT, and RoBERTa), a sentence's syntax tree is mostly extractable by our probe, suggesting these models have access to syntactic information while composing their contextual representations. Whether this information is actually used by these models, however, remains an open question. 	@inproceedings{pimentel-etal-2022-attentional,     title = "The Architectural Bottleneck Principle",     author = "Pimentel, Tiago  and       Valvoda, Josef  and       Stoehr, Niklas  and       Cotterell, Ryan",     booktitle = "Proceedings of the 2022 Conference on Empirical Methods in Natural Language Processing",     month = dec,     year = "2022",     address = "Abu Dhabi, United Arab Emirates",     publisher = "Association for Computational Linguistics",     url = "https://aclanthology.org/2022.emnlp-main.788",     pages = "11459--11472",     abstract = "", }	inproceedings	pimentel-etal-2022-architectural	2022	11459--11472			
2023-05-01	On the Intersection of Context-Free and Regular Languages	Clemente Pasti, Andreas Opedal, Tiago Pimentel, Tim Vieira, Jason Eisner, Ryan Cotterell	Proceedings of the 17th Conference of the European Chapter of the Association for Computational Linguistics		Clemente Pasti, Andreas Opedal, Tiago Pimentel, Tim Vieira, Jason Eisner, and Ryan Cotterell. 2023. On the Intersection of Context-Free and Regular Languages. In Proceedings of the 17th Conference of the European Chapter of the Association for Computational Linguistics, pages 737–749, Dubrovnik, Croatia. Association for Computational Linguistics.	pasti-etal-2023-intersection	https://aclanthology.org/2023.eacl-main.52/	The Bar-Hillel construction is a classic result in formal language theory. It shows, by a simple construction, that the intersection of a context-free language and a regular language is itself context-free. In the construction, the regular language is specified by a finite-state automaton. However, neither the original construction (Bar-Hillel et al., 1961) nor its weighted extension (Nederhof and Satta, 2003) can handle finite-state automata with ε-arcs. While it is possible to remove ε-arcs from a finite-state automaton efficiently without modifying the language, such an operation modifies the automaton’s set of paths. We give a construction that generalizes the Bar- Hillel in the case the desired automaton has ε-arcs, and further prove that our generalized construction leads to a grammar that encodes the structure of both the input automaton and grammar while retaining the asymptotic size of the original construction.	@inproceedings{pasti-etal-2023-intersection,     title = "On the Intersection of Context-Free and Regular Languages",     author = "Pasti, Clemente  and       Opedal, Andreas  and       Pimentel, Tiago  and       Vieira, Tim  and       Eisner, Jason  and       Cotterell, Ryan",     booktitle = "Proceedings of the 17th Conference of the European Chapter of the Association for Computational Linguistics",     month = may,     year = "2023",     address = "Dubrovnik, Croatia",     publisher = "Association for Computational Linguistics",     url = "https://aclanthology.org/2023.eacl-main.52",     pages = "737--749",     abstract = "The Bar-Hillel construction is a classic result in formal language theory. It shows, by a simple construction, that the intersection of a context-free language and a regular language is itself context-free. In the construction, the regular language is specified by a finite-state automaton. However, neither the original construction (Bar-Hillel et al., 1961) nor its weighted extension (Nederhof and Satta, 2003) can handle finite-state automata with ε-arcs. While it is possible to remove ε-arcs from a finite-state automaton efficiently without modifying the language, such an operation modifies the automaton{'}s set of paths. We give a construction that generalizes the Bar- Hillel in the case the desired automaton has ε-arcs, and further prove that our generalized construction leads to a grammar that encodes the structure of both the input automaton and grammar while retaining the asymptotic size of the original construction.", }	inproceedings	pasti-etal-2023-intersection	2023	737--749			
2023-05-02	On the Usefulness of Embeddings, Clusters and Strings for Text Generation Evaluation	Tiago Pimentel, Clara Meister, Ryan Cotterell	The Eleventh International Conference on Learning Representations		Tiago Pimentel, Clara Isabel Meister, and Ryan Cotterell. "On the Usefulness of Embeddings, Clusters and Strings for Text Generation Evaluation." The Eleventh International Conference on Learning Representations. 2022.	pimentel-etal-2023-usefulness	https://openreview.net/forum?id=bvpkw7UIRdU	A good automatic evaluation metric for language generation ideally correlates highly with human judgements of text quality.  Yet, there is a dearth of such metrics, which inhibits the rapid and efficient progress of language generators. One exception is  the recently proposed Mauve. In theory, Mauve measures an information-theoretic divergence between two probability distributions over strings: one representing the language generator under evaluation; the other representing the true natural language distribution. Mauve's authors argue that its success comes from the qualitative properties of their proposed divergence.  Yet in practice, as this divergence is uncomputable, Mauve approximates it by measuring the divergence between multinomial distributions over clusters instead, where cluster assignments are attained by grouping strings based on a pretrained language model's embeddings. As we show, however, this is not a tight approximation---in either theory or practice. This begs the question: why does Mauve work so well? In this work, we show that \mauve was right for the wrong reasons, and that its newly proposed divergence is not necessary for its high performance. In fact, classical divergences paired with its proposed cluster-based approximation may actually serve as better evaluation metrics. We finish the paper with a probing analysis; this analysis leads us to conclude that---by encoding syntactic- and coherence-level features of text, while ignoring surface-level features---such cluster-based approximations to string distributions may simply be better for evaluating state-of-the-art language generators.	@inproceedings{pimentel2023on, title={On the Usefulness of Embeddings, Clusters and Strings for Text Generation Evaluation}, author={Tiago Pimentel and Clara Isabel Meister and Ryan Cotterell}, booktitle={The Eleventh International Conference on Learning Representations }, year={2023}, url={https://openreview.net/forum?id=bvpkw7UIRdU} }	inproceedings	pimentel-etal-2023-usefulness	2023				
